Windows PowerShell
Copyright (C) Microsoft Corporation. All rights reserved.

PS C:\Users\ELD> cd "C:\Program Files\PostgreSQL\17\bin"
PS C:\Users\ELD> psql -U postgres
Password for user postgres:

psql (17.6)
WARNING: Console code page (437) differs from Windows code page (1252)
         8-bit characters might not work correctly. See psql reference
         page "Notes for Windows users" for details.
Type "help" for help.

postgres=# BEGIN;
BEGIN
postgres=# UPDATE accounts SET balance = balance - 100 WHERE account_id = 1;
UPDATE 1
postgres=# UPDATE accounts SET balance = balance + 100 WHERE account_id = 2;
UPDATE 1
postgres=# COMMIT;
COMMIT

postgres=# BEGIN;
BEGIN
postgres=# UPDATE accounts SET balance = balance - 100 WHERE account_id = 1;
UPDATE 1
postgres=# UPDATE accounts SET balance = balance + 100 WHERE account_id = 2;
UPDATE 1
postgres=# ROLLBACK;
ROLLBACK

postgres=# BEGIN;
BEGIN
postgres=# SELECT balance FROM accounts WHERE account_id = 1;
 balance
----------
  1200.00
(1 row)

postgres=# UPDATE accounts SET balance = balance - 500 WHERE account_id = 1;
UPDATE 1
postgres=# UPDATE accounts SET balance = balance + 500 WHERE account_id = 2;
UPDATE 1
postgres=# COMMIT;
COMMIT



postgres=# BEGIN;
BEGIN
postgres=# INSERT INTO orders (customer_id, total) VALUES (1, 250.00);
INSERT 0 1
postgres=# INSERT INTO order_items (order_id, product_id, quantity) VALUES (1, 101, 2);
INSERT 0 1
postgres=# UPDATE inventory SET stock = stock - 2 WHERE product_id = 101;
UPDATE 1
postgres=# COMMIT;
COMMIT

postgres=# BEGIN TRANSACTION ISOLATION LEVEL READ COMMITTED;
BEGIN
postgres=# SELECT * FROM accounts WHERE balance > 1000;
 account_id | balance
------------+----------
          2 |  1300.00
(1 row)
postgres=# COMMIT;
COMMIT



postgres=# BEGIN;
BEGIN
postgres=# INSERT INTO customers (name, email) VALUES ('Nathan Wagner', 'nathan@email.com');
INSERT 0 1
postgres=# SAVEPOINT after_customer_insert;
SAVEPOINT
postgres=# INSERT INTO orders (customer_id, total) VALUES (1, 500.00);
INSERT 0 1
postgres=# ROLLBACK TO SAVEPOINT after_customer_insert;
ROLLBACK
postgres=# INSERT INTO orders (customer_id, total) VALUES (1, 300.00);
INSERT 0 1
postgres=# COMMIT;
COMMIT

postgres=# BEGIN;
BEGIN
postgres=# INSERT INTO products (name, price) VALUES ('Laptop', 999.99);
INSERT 0 1
postgres=# SAVEPOINT sp1;
SAVEPOINT
postgres=# INSERT INTO products (name, price) VALUES ('Mouse', 25.99);
INSERT 0 1
postgres=# SAVEPOINT sp2;
SAVEPOINT
postgres=# INSERT INTO products (name, price) VALUES ('Invalid Product', -50.00);
ERROR:  new row for relation "products" violates check constraint "positive_price"
postgres=# ROLLBACK TO SAVEPOINT sp2;
ROLLBACK
postgres=# INSERT INTO products (name, price) VALUES ('Keyboard', 79.99);
INSERT 0 1
postgres=# COMMIT;
COMMIT

postgres=# BEGIN;
BEGIN
postgres=# DO $$
DECLARE
    insufficient_funds EXCEPTION;
    current_balance DECIMAL;
BEGIN
    SELECT balance INTO current_balance FROM accounts WHERE account_id = 1;
    IF current_balance < 100 THEN
        RAISE insufficient_funds;
    END IF;
    UPDATE accounts SET balance = balance - 100 WHERE account_id = 1;
    UPDATE accounts SET balance = balance + 100 WHERE account_id = 2;
EXCEPTION
    WHEN insufficient_funds THEN
        RAISE NOTICE 'Transaction failed: Insufficient funds';
        ROLLBACK;
END $$;
DO
NOTICE:  Transaction failed: Insufficient funds

postgres=# SELECT
    blocked_locks.pid AS blocked_pid,
    blocked_activity.usename AS blocked_user,
    blocking_locks.pid AS blocking_pid,
    blocking_activity.usename AS blocking_user,
    blocked_activity.query AS blocked_statement
FROM pg_catalog.pg_locks blocked_locks
JOIN pg_catalog.pg_stat_activity blocked_activity
    ON blocked_activity.pid = blocked_locks.pid
JOIN pg_catalog.pg_locks blocking_locks
    ON blocking_locks.locktype = blocked_locks.locktype
WHERE NOT blocked_locks.granted;
 blocked_pid | blocked_user | blocking_pid | blocking_user | blocked_statement
-------------+--------------+--------------+---------------+-------------------
(0 rows)

postgres=# BEGIN;
BEGIN
postgres=# INSERT INTO audit_log (action, timestamp) VALUES ('user_creation', NOW());
INSERT 0 1
postgres=# INSERT INTO users (name, email) VALUES ('Nathan Wagner', 'nathan@example.com');
INSERT 0 1
postgres=# INSERT INTO user_preferences (user_id, theme) VALUES (currval('users_id_seq'), 'dark');
INSERT 0 1
postgres=# COMMIT;
COMMIT

postgres=#